english_sent,nepali_sent
In1894 she went to England for her higher studies and at that time she studied as well as she has been writing many poemsG,In1894 She उनी आफ्नो उच्च अध्ययन को लागी इ England ्ल्यान्ड गए र उनी धेरै कविता लेखिरहेका छन्
Initially water supply to this canal was done by making temporary baandh,सुरुमा यो नहर आपूर्ति अस्थायी बाडा बनाएर गरिएको थियो
One Mecca Part and another Madina part,एक MECCA भाग र अर्को मदन भाग
To attain Nirvana,निर्वाण प्राप्त गर्न
When Brahmas vision falls on Maya then we see God in the image of Brahma,जब ब्रादिसमेश मायामा खस्छ तब हामी भगवानलाई ब्रह्माको स्वरूपमा देख्छौं
So these trajectories here are basically how we would expect people to live,त्यसैले यी ट्र्याक्वेजहरू यहाँ छन् कि हामी कसरी बाँच्ने आशा गर्छौं भनेर आशा गर्दछौं
Most of the highest mountain peaks of the world are situated at Himalaya,विश्वका सब भन्दा उच्च पहाडी चुचुरो हिमालयमा अवस्थित छन्
Nevada,नेभाडा
Thank you,धन्यवाद
But if youre not a native speaker,तर यदि तपाईं नेटिभ वक्ता छैन
we discount sounds that remain the same,हामी उस्तै आवाजहरू छुट्टी दिन्छौं
As a result  production of super varieties was increasing though the acreage was falling ,एक परिणाम बृद्धि को रूप मा सुपर प्रजातिहरूको उत्पादन बढ्दै गइरहेको थियो जबकि एकरेज खस्दै छ
The next breakthrough is to cut that 10 million in half again,अर्को परिशिष्ट आधा मा दुई लाख काट्नु हो
Spread over an area of 8325 sq km in the Bay of Bengal  these island territories have been known for exotic turtles and virgin tropical forests ,Banguls325 SQ किलोमिको क्षेत्रमा फैलियो यी टापुको इलाकामा यी टापुको क्षेत्रको क्षेत्रमा विदेशी कछुवा र भर्जिनटिबंधीय वनहरूको लागि परिचित छन्
If we did we could dictate the agenda and Pakistan would have to listen ,यदि हामीले गरेका थियौं भने एजेन्डा र पाकिस्तानले सुन्नुपर्नेछ
He continued to be a spokesman for the Muslims  and wherever they had valid grievances he knew that any sympathy or help that the Muslims received from others could only be a salve  it could never be a cure ,उहाँ मुस्लिमहरूको प्रवक्ता बन्नुभयो र जहाँ तिनीहरूसँग जान्दछौं कि उनीहरूलाई कुनै सहानुभूति वा मद्दत गर्दछ कि मुस्लिमहरू अरूबाट प्राप्त भएको एक स्टाइल हुन सक्छ
oneupmanship,Quupanip
if you made literature affordable and available to them,यदि तपाईंले साहित्य प्रयोग गर्नुभयो र तिनीहरूलाई उपलब्ध गराउनुभयो भने
No other national leader except Nehru shared that concern ,Nehrrh बाहेक अरु कुनै राष्ट्रिय नेताले त्यो चिन्ता साझा गरे
Now up until that moment,अब सम्म सम्म माथि सम्म
को सीखने के लिए खुला रख पाएँ,लियोन
because all the information as I said are inside the DNA,किनभने मैले भनेका अनुसार सबै जानकारी डीएनएन भित्र छन्
if Nike wanted to sell a pair of shoes,किनभने मैले भनेका अनुसार सबै जानकारी डीएनएन भित्र छन्
Category: Biography,किनभने मैले भनेका अनुसार सबै जानकारी डीएनएन भित्र छन्
Scbaceous prominences: look like spots of mustard emerged from peniss sebaceous glands and common,किनभने मैले भनेका अनुसार सबै जानकारी डीएनएन भित्र छन्
youre sitting there looking at the person waiting for them to look away,किनभने मैले भनेका अनुसार सबै जानकारी डीएनएन भित्र छन्
Clean fresh water should always be provided to them ,किनभने मैले भनेका अनुसार सबै जानकारी डीएनएन भित्र छन्
Between Sri Harsha and Vikramaditya there is an interval of 400 years  as I have been told by some of the inhabitants of that region ,किनभने मैले भनेका अनुसार सबै जानकारी डीएनएन भित्र छन्
When disturbed or alarmed  this beetle explodes a malodorous and caustic volatile liquid  with a loud report  from its anal end and makes good its escape  leaving behind an utterly confused enemy  overcome by acrid fumes ,किनभने मैले भनेका अनुसार सबै जानकारी डीएनएन भित्र छन्
Hindi font checker adon for Firefox,किनभने मैले भनेका अनुसार सबै जानकारी डीएनएन भित्र छन्
If you temporarily transfer them from an overseas branch or subsidiary or if the person is seconded to you from an overseas employer it may be appropriate for the overseas contract of employment to continue ,किनभने मैले भनेका अनुसार सबै जानकारी डीएनएन भित्र छन्
(Laughter),किनभने मैले भनेका अनुसार सबै जानकारी डीएनएन भित्र छन्
The Government took away a large part of its produce in the form of land revenue and other taxes ,किनभने मैले भनेका अनुसार सबै जानकारी डीएनएन भित्र छन्
Apart from his police duties  the Kotwal also enjoyed some judicial powers ,किनभने मैले भनेका अनुसार सबै जानकारी डीएनएन भित्र छन्
But they were more anarchists and syndicalists than socialists ,किनभने मैले भनेका अनुसार सबै जानकारी डीएनएन भित्र छन्
Drug addiction you simply want more,किनभने मैले भनेका अनुसार सबै जानकारी डीएनएन भित्र छन्
English Hindi dictionary in PDF form,किनभने मैले भनेका अनुसार सबै जानकारी डीएनएन भित्र छन्
They take three to four rounds of a fourkilometre stretch alongside which are placed 15 idols ,किनभने मैले भनेका अनुसार सबै जानकारी डीएनएन भित्र छन्
The number of elephants in an akihauhim is 21870 ; the number of chariots  too  |BAR;s 21870 ; the number of horses is 153090 ; the number of men  459283 ,किनभने मैले भनेका अनुसार सबै जानकारी डीएनएन भित्र छन्
If I spin this pulley the small ones going to spin much faster,किनभने मैले भनेका अनुसार सबै जानकारी डीएनएन भित्र छन्
is actually when I first returned to Iran,किनभने मैले भनेका अनुसार सबै जानकारी डीएनएन भित्र छन्
It can be argued  that these are spurious rules and to know the real ones we should go to the Vedas or to our philosophy ,किनभने मैले भनेका अनुसार सबै जानकारी डीएनएन भित्र छन्
Or perhaps  it was his own disinterest in culture that prevented him from noticing that during the many years of Indira s leadership   immense and priceless  monuments were allowed to fall to rack and ruin ,किनभने मैले भनेका अनुसार सबै जानकारी डीएनएन भित्र छन्
The last incumbent of the British regime before Japanese occupation was Scot ,किनभने मैले भनेका अनुसार सबै जानकारी डीएनएन भित्र छन्
Some species might live by freshwater and bite animals  whereas others might live near salt water and bite humans ,किनभने मैले भनेका अनुसार सबै जानकारी डीएनएन भित्र छन्
that believe it or not I have picked up,किनभने मैले भनेका अनुसार सबै जानकारी डीएनएन भित्र छन्
In our mind the relevant metric,किनभने मैले भनेका अनुसार सबै जानकारी डीएनएन भित्र छन्
Many dances are also performed with ancient historical weapons ,किनभने मैले भनेका अनुसार सबै जानकारी डीएनएन भित्र छन्
All the ancient medical texts state that prameha of any variety  if neglected  will finally lead to madhumeha and in due course become incurable ,किनभने मैले भनेका अनुसार सबै जानकारी डीएनएन भित्र छन्
veda is written in a very difficult and hard language,किनभने मैले भनेका अनुसार सबै जानकारी डीएनएन भित्र छन्
This temple built near golf course and airport is believed to be the residence of God,किनभने मैले भनेका अनुसार सबै जानकारी डीएनएन भित्र छन्
And I started watching Kaki King a lot,किनभने मैले भनेका अनुसार सबै जानकारी डीएनएन भित्र छन्
The fine Dacca muslin was the envy of the world for centuries together ,किनभने मैले भनेका अनुसार सबै जानकारी डीएनएन भित्र छन्
Then as Vyasa guided them to go Panchal state they have gone there and there was the Swayamvara of Droupadi,किनभने मैले भनेका अनुसार सबै जानकारी डीएनएन भित्र छन्
In the secular world we think If an idea is important Ill bump into it,किनभने मैले भनेका अनुसार सबै जानकारी डीएनएन भित्र छन्
You can stay with me for 20 years go tomorrow,किनभने मैले भनेका अनुसार सबै जानकारी डीएनएन भित्र छन्
At its core is India s first genetically modified seed  infamously called BT Cotton ,किनभने मैले भनेका अनुसार सबै जानकारी डीएनएन भित्र छन्
have had what you might call a spiritual experience,किनभने मैले भनेका अनुसार सबै जानकारी डीएनएन भित्र छन्
In the present phase of the Ayodhya movement  the eight worst cities listed above will have to be watched ,किनभने मैले भनेका अनुसार सबै जानकारी डीएनएन भित्र छन्
that we developed called IMPASS,किनभने मैले भनेका अनुसार सबै जानकारी डीएनएन भित्र छन्
Ancient Sanskrit literature is extremely old vast and diverse,किनभने मैले भनेका अनुसार सबै जानकारी डीएनएन भित्र छन्
And they go over all this  Im going to try to be,किनभने मैले भनेका अनुसार सबै जानकारी डीएनएन भित्र छन्
The progress of the major industrial machinery groups is reviewed below ,किनभने मैले भनेका अनुसार सबै जानकारी डीएनएन भित्र छन्
Just out of curiosity how many of you?,किनभने मैले भनेका अनुसार सबै जानकारी डीएनएन भित्र छन्
The diesel engine has certainly been a boon to modern industry  agriculture and transport ,किनभने मैले भनेका अनुसार सबै जानकारी डीएनएन भित्र छन्
This festival celebrates twice in year but in time period it is limited up to residents of Bihar and Eastern Uttar Pradesh,किनभने मैले भनेका अनुसार सबै जानकारी डीएनएन भित्र छन्
The evolution  according to them  takes place in six stages  where each stage is a reflection of the mental state of the aspirant ,किनभने मैले भनेका अनुसार सबै जानकारी डीएनएन भित्र छन्
prostate tumor activity is shown in red  you can,प्रोस्टेट ट्यूमर गतिविधि रातोमा देखाइएको छ
In 2001 her life changed,2001 मा उनको जीवन परिवर्तन भयो
They have a charming literary quality and they tell us that the author was an ardent devotee of Shiva ,तिनीहरूसँग एक आकर्षक साहित्यिक गुणस्तर छ र तिनीहरूले हामीलाई बताउँछन् कि लेखक शिवको एक शवक भक्त भक्तशक्ति हो
sort out formal complaints within six months of getting them LRB formal complaints are handled under legal rules RRB ;,औपचारिक गुनासोहरू क्रमबद्ध गर्नुहोस् उनीहरूका छ महिना भित्र एलबीबी औपचारिक गुनालहरू कानुनी नियम rrb अन्तर्गत हस्तान्तरण गरिएको छ;
This inverse relationship suggests another important conclusion ,यो इनवेयर सम्बन्ध अर्को महत्त्वपूर्ण निष्कर्ष सुझाव दिन्छ
this complex is covered with four very big gardens one is Moguls garden,यो जटिल चार धेरै धेरै बगैंचामा कभर गरिएको छ एक मोगल गार्डन हो
The new state was established in fifth century in vaishali region,नयाँ राज्य VAISHALI क्षेत्रमा पाँचौं शताब्दीमा स्थापना भएको हो
So he takes their radio talks to their boss,त्यसैले उसले आफ्नो रेडियोको कुराकानीलाई उनीहरूको मालिकलाई लिन्छ
In the year 1947 after the independence it became the capital of Mumbai state,सन् 1 194 .7 मा यो स्वतन्त्रता पछि यो मुम्बई राज्यको राजधानी भयो
Here in India  I m too poor to be twiddling my thumbs  but as I spend my days scrubbing  cleaning  cooking and washing  I also worry and wonder ,यहाँ भारतमा म मेरो थमिबिंगको लागि म पनि धेरै बिभिन्न छु तर मैले मेरो दिनहरू सफा गर्दै खन्दा र धुने काम गर्छु
Before his departure for Europe  Subhas Chandra was brought back for a while to Jabalpur jail where his brother was held ,युरोप युरोप सुतराद चौरान्द्रलाई एक समय पछि उसको दाइ बनेको थियो जहाँ उनको भाई आयोजना गरियो
We can think really that each one is sort of,हामी वास्तवमै सोच्न सक्छौं कि प्रत्येक एक क्रमबद्ध छ
He further argued that Brahnwnism preached only karma and not bhakti ,उनले तर्क गरे कि गाला ल्याण्डेजले कर्म मात्रै कर्मालाई प्रचार गर्यो र भक्तकी छैन
In the meantime war started between USSR and Japan and they were busy on their borders,यस बीचमा युएसएसआर र जापान बीचको युद्ध सुरु भयो र उनीहरू उनीहरूको सिमानामा व्यस्त थिए
Scepticism itself  when it proceeds from vigorous natures true to the core  when it is an expression of strength and not of weakness  joins in the march of the Grand Army of the religious Soul  ,Scepticum आफै जब यो जोडदार स्वभावबाट अगाडि बढ्छ मुख्य शक्तिमा जब यो शक्तिको अभिव्यक्ति हुन्छ र दुर्बलताको अभिव्यक्ति धार्मिक आत्माको महान् सेनाको मार्चमा सामेल हुँदैन
and we were walking,र हामी हिंडिरहेका छौं
He is the only player in the world who scored more than 12000 runs in the test cricket,उहाँ विश्वमा एक मात्र खेलाडी हुनुहुन्छ जसले परीक्षण क्रिकेटमा 120000 भन्दा बढी रन बनाए
The antiCongress section of Muslims who had now joined the Muslim League found the cultural issue far more effective in inciting their community against the Congress than the purely religious issue had proved to be ,मुस्लिमको ईच्छापूर्ण सेक्सेट जो अहिले मुस्लिम लिगमा सामेल भएर सांस्कृतिक मुद्दालाई पूर्ण रूपमा सान्त्वनाका विरुद्धमा स्वास्थ्यसुसीमा बढी प्रभावकारी बनाउँदछन्।
Categories of Ministers,मन्त्रीहरूको कोटीहरू
The other areas are Rangat and Great Nicobar ,अन्य क्षेत्रहरू रनट र महान निकबार छन्
Sometimes a blood clot may completely block the flow of blood with severe consequences  ie  a heart attack ,कहिलेकाँही रगत वञ्चेलले पानीको प्रवाहलाई गम्भीर नतिजाको साथ रगतको प्रवाह रोक्न सक्छ।
many signs are just like the normal signs of growing up ,धेरै संकेतहरू केवल बढ्दो सामान्य संकेतहरू जस्तै छन्
Crazy rituals and divine circus  not to speak of the snakecharmer s roadshow and the naked sadhu s nirvana rites ,पागल रीतिथिति र ईश्वरीय सर्कस सर्पदार स्क्वायर स्क्वाश र नग्न बिरुभु वा नग्न सार्बु।
It was but natural for them to employ in their writings the language of the masses ,उनीहरूको लेखन उनीहरूको लेखनमा काम गर्नेहरूको लागि स्वाभाविक थियो
What you see over here this yellow thing this is not a death ray (Laughter),तपाईले यहाँ के देख्नुहुन्छ यो पहेंलो काम (हाँसो) होइन
Chris Anderson: So Pranav,क्रिस एन्डरसन: धेरै प्रुभ
The British policy only helped to transfer resources from peasants and craftsmen to merchants  moneylenders and foreign capitalists ,ब्रिटिश नीतिले केवल व्यापारी र विदेशी पूंजीपतिहरूबाट स्रोतहरू स्थानान्तरण गर्न मद्दत गर्यो
I think so,मलाई त्यस्तै लाग्छ
In modern times poet Jagnnatadass ratakar Kapil Muni in the book by Gangwatraran boon Sea delivers with a thousand Putro Bhagirath the Bhagirath  penance is a story of being descended from the Ganges to the ground!,आधुनिक टाइम्स जुन्टनस रचेदार रुकुता कपिल कपिल कपिल कुन्णीले भायराहातका लागि गिल्लाथथ मूर्तिपूजकलाई जमिनमा नहेर्नुको कथा हो!
many opinions present regarding reasons of terrorism they say range demographic socioeconomic for political reasons demographic factors and crowd can include high growth rate social factors poverty unemployment and land term problems may include disenfranchisement ethnic confict religious confict territorial conflict resources or to use for revenge,आतंकवादको कारणहरूसम्बन्धी आतंकवादका कारणहरूसमेत उनीहरू राजनीतिक कारणका कारणहरूले डेमोग्राफिक सामाजिक कारकहरू र जनसंख्याको सामाजिक कारकहरू समावेश गर्न सक्छन् र बदला लिनका लागि प्रयोग गर्न सक्छन्
 IF YOU CAN GIVE CHILDREN EMOTIONAL SECURITY  THEY WILL LEARN BETTER LATER ON  AND YOU WILL HAVE MADE AN IMPORTANT CONTRIBUTION TO THEIR LIVES  ,यदि तपाईं बच्चाहरूलाई भावनात्मक सुरक्षा दिन सक्नुहुन्छ भने उनीहरूले अझ राम्रो सिक्नेछन् र तपाईंले उनीहरूको जीवनमा महत्त्वपूर्ण योगदान दिनुहुनेछ
and they said No problem We probably hit some birds,र उनीहरूले भने कि हामीले कुनै समस्या छैनौं कि हामी सायद केही चराहरूमा थियौं
if you want a comic book to do well make the librarians the hero It always works well,यदि तपाइँ एक हास्य पुस्तक चाहानुहुन्छ कि liverians लाई हजुरआमाका नायकहरु बनाउन चाहानुहुन्छ यो सँधै राम्रो काम गर्दछ
The commencement of Kathak Dance took place between the 6th7th century in Northern India,उत्तरी भारतमा 6th औं शताब्दीको बीचमा कताच नृत्यको सुरुवात भयो
The address is : http : //wwwdssgovuk,ठेगाना हो: http: // wwwddsssguk
The coalition he leads is larger than ever but relatively stable ,गठबन्धन उहाँ नेतृत्व गर्नु भन्दा पहिलेको भन्दा ठूलो हुन्छ तर अपेक्षाकृत स्थिर
DPC uses naphtha as fuel for its phase I plant ,DPC ले यसको चरणको लागि नेप्टुले ईन्धन प्रयोग गर्दछ
