english_sent,nepali_sent
If you ask children and teenagers who use drugs why they do it  they say :,यदि तपाईं बच्चाहरू र किशोर-किशोरीहरूलाई सोध्नुहुन्छ कि किन उनीहरूले ड्रग्सलाई किन गर्छन् भन्छन्:
She wears it every day,उनी हरेक दिन यो लगाउँछिन्
Before that Mahadeviverma got Succeria award for Niraja in 1974 In 1942 She was given a medal for Smruti ki rekahayein,त्यो महोदयवारिकले 1 194 44 मा निरर्जाका लागि superia पुरस्कार प्राप्त भयो जुन 1 194 2 मा 1 42 2 मा उनलाई स्मैत किईराइनको लागि पदक दिइयो
Im working on an initiative now along with the World Bank,म विश्व बैंकको साथ अब पहलमा काम गर्दैछु
Some of them have the opinion that they were ancestors of Aryans and are other says that they are Dravidian,तिनीहरू मध्ये केही छन् कि तिनीहरू आरीहरू आक्रोशका पुर्खाहरू थिए र अन्य हुन् कि तिनीहरू रेडिडियन हुन्
More important is the following basic and new feature of the Constitution :  The draft visualises organised democracy as the source of all constitutional authoritythe instrument for the exercise of popular sovereignty ,संविधानको निम्न आधारभूत र संविधानको नयाँ सुविधा होः लोकतन्त्रलाई लोकतन्त्रको लागि लोकतान्त्रिक सार्वभौमिकताको अभ्यासको लागि सबै संवैधानिक अधिकारको स्रोतको रूपमा संगठित दृश्यहरू छन्
I think there is an alternative,मलाई लाग्छ कि एक विकल्प छ
Some of Roy s associates from various parts of the country had also collected there to meet him and welcome him back in their midst ,देशका विभिन्न भागका केही एसोसिएसनहरू उनीसँग भेट गर्न त्यहाँ पनि स collected ्कलन गरी उनीहरूको बीचमा स्वागत गरे
There is no debate on such a statement but each member in whose name the matter is listed is permitted to ask a clarificatory question ,यस्तो बयानको बारेमा कुनै बहस छैन तर प्रत्येक सदस्य जसको नाममा जसको नाम सूचीबद्ध छ कि एक स्पष्टीकरण प्रश्न सोध्न अनुमति दिइन्छ
Other,अरु
Sunga Lyal S Terrorisim opposion policy of America and Replacement of Asia Jhone Smith and Gomez( eds) 11 September and Political Freedom: Asian Senierio (choice) (2002)242264,एशिया झोौंको आतंकवादको आतंकवाद स्मिथ र गोमेज (एडीएस) 11 सेप्टेम्बर र राजनैतिक स्वतन्त्रता (छनोट) (2002) 2 2002222264
On reaching Milali they were greatly excited and started running  jumping and shouting all over the vessel ,मिलाली पुग्ने क्रममा तिनीहरू धेरै उत्साहित थिए र जम्पिंग चलिरहेको थियो र सबै भाँडोमा सबै भाँडो
Masterpieces,मास्टरपीपीसीहरू
Its Arabs versus Israelis labor versus management,यसको अरबहरू बनाम इजरायली श्रम बनाम व्यवस्थापन व्यवस्थापन
Gandhinagar s cupboards are full of such skeletons ,Gandhinagar s coodwords त्यस्ता कंकाल भरिएको छ
Wars have taken place with China in 1962 as well as with Pakistan in 1947 1965 1971 and 1999,युद्धको साथ 1 62 62 मा पनि 1 19 67 1 19475 1 19 67 1 1971 1 र 1 197 57 र 1 197 1 मा पाकिस्तानसँगै छ
This word has also another similar syrian meaning khurian which means read the books,यो शब्दसँग पनि अर्को समान सिरियाको अर्थ खोरको अर्थ हो जसको अर्थ पुस्तकहरू पढ्नुहोस्
See this also,यो पनि हेर
There is a octagon in the interior area which has a door in each of its sides but actually only the door on the south side leading to the garden is in use,त्यहाँ आन्तरिक क्षेत्रमा अष्टोप छ जुन यसको प्रत्येक पक्षमा ढोका छ तर वास्तवमा दक्षिण पक्षमा मात्र ढोका प्रयोगमा जान्छ
In March 2004 the part of Mumbai Grand Prix F1 Power Boat Race world competition was organized here,मार्च 200 2004 मा मुम्बई ग्रान्ड Praigh F1 पावर डु boat ्गा रेस विश्व प्रतियोगिता यहाँ आयोजना गरिएको थियो
Internet in India,भारतमा इन्टरनेट
The author himself explained that the Boat symbolised for him Life which collects the harvest of our achievement and goes floating on the stream of time  leaving us behind ,लेखकले यो कुरा बताए कि डु boat ्गाले आफ्नो जीवनको प्रतीकलाई चित्रण गरे जसले हाम्रो उपलब्धिको फसल संकलन गर्दछ र हामीलाई पछाडि छोड्दै गरेको प्रवाहमा तैरिरहेको छ
They asked the government to intervene in the market on their behalf and make some obligatory purchases from them ,उनीहरूले सरकारमा बजारमा हस्तक्षेप गर्न आग्रह गरे र उनीहरूबाट केही अनिवार्य खरीदहरू बनाउनुहोस्
Fine  but why then are we speaking to a group of terrorists who were put into business by Pakistan with the specific objective of furthering that country s cause in the Valley ?,ठिक छ तर किन हामी आतंकवादीहरूको एउटा समूहमा कुरा गर्दैछौं जसले उपत्यकामा त्यस देशको कारणको अगाडिको उद्देश्यको साथ पाकिस्तानद्वारा व्यवसायमा राखेका थिए?
Foreign links,विदेशी लि ्गीहरु
Some single person only learns this and even he LRB only RRB a portion but not the whole ,केहि एकल व्यक्तिले यसलाई मात्र सिक्छ र उसले समेत एक अंश मात्र rrb मात्र भाग गर्दैन
So this woman comes in and shes taken into the operating room,त्यसैले यो महिला आउँछिन् र अपरेटिंग कोठामा लगियो
The region accounts for more than 25 per cent of the total potato produced in the country ,क्षेत्र मा 2 25 प्रतिशत भन्दा बढीको लागि देशमा 2 25 प्रतिशत भन्दा बढीको लागि खाताहरू
Now religions have a much saner attitude to art,अब धर्मको लागि धेरै सान दृष्टिकोण छ
10 days away from proving that the product they produced,10 दिन टाढा उनीहरूले उत्पादन गरेको उत्पादन
And when I sat the students down I said Whos got the best one?,र जब म विद्यार्थीहरू बसेँ मँ त्यहाँ मैले भने कि WHOS सबैभन्दा राम्रो भयो?
As part of the effort  the Charminar Heritage Walks were flagged off in September 2000 ,प्रयासको एक भागको रूपमा क्लियरी सम्पदा हिंड्स सेप्टेम्बर 2000 मा फ्ल्याग गरिएको थियो
somehow suddenly things mattered,कुनै तरिकाले अचानक चीजहरू माथि उठेका छन्
by email to :,ईमेल द्वारा:
Even breathing becomes a problem because the aluminium compounds accumulate in their gills ,सास फेर्न समस्या बन्छ किनकि एल्युमिनियम यौगिकहरू उनीहरूको गेलमा जम्मा हुन्छन्
Parabrahma is absolute infinite and without form and body,प्याराब्राफमा निरपेक्ष असीम र फार्म र शरीर बिना
The Board estimated that about 40 per cent of Japanese imports competed directly with the staple products of Indian mills ,बोर्डले अनुमान गरे कि जापानी आयातका करिब percent0 प्रतिशतले सीधा भारतीय मिलहरूको मुख्य उत्पादनहरूको साथ प्रतिस्पर्धा गरे
SECTION 1 Diabetes mellitus is known to mankind from time immemorial ,सेक्सन 1 मधुमेह मेलिटस समयदेखि मानिसजातिको लागि परिचित छ
The observance of his birthday in that little mountainous village had a simple and austere dignity which could hardly have been possible in a bigger place like Kalimpong  much less in a city like Calcutta ,त्यो सानो हिमाली गाउँमा उसको जन्मदिनको पालना गर्नुहोस् जुन कलकत्ता जस्तो शहरमा धेरै कम कमजस्तो सम्भव भएको छ।
In the teachers contract,शिक्षक सम्झौतामा
No State could  therefore secede from the Union nor could it suo motu vary its territory as laid down in the First Schedule to the Constitution ,त्यसकारण कुनै राज्यले युनियनबाट भाग लिन सक्दैन न त यो सुमो सुमोको संविधानलाई पहिलो तालिकामा राखिने क्रममा फरक छ
Really?,साच्चिकै?
Picture of the floor/ base program of Taj Mahal,ताज कोहीको भुइँ / आधार कार्यक्रमको चित्र
The Constitution of India declares India as a soverign socialist secular democratic republic,भारतका संविधानले भारतको सार्वभौमिक ज्युजिष्टरवादी सांसारिक प्रजातान्त्रिक गणतन्त्रको रूपमा घोषणा गर्दछ
Its in that context that I work,यो एक सन्दर्भमा जुन म काम गर्छु
We reconditioned them all fixed them,हामी तिनीहरूलाई सबै फिक्सहरू पुन: प्राप्ति गर्दछौं
People from all age group delighted with vividcolorful sparkler firecrackers and AAnar(Sparkling flower pot),सबै उमेर समूहका व्यक्तिहरू भोकस्क्लराल स्पार्कलर रेख्रा गर्नेहरू र आयरर (स्पार्कलिंग फ्लोट भाँडो) को साथ खुशी थिए
In its anxiety to cover the whole field  the observations and criticism by the Parliament have tended to be general  repetitive and formal ,संसदले सम्पूर्ण क्षेत्रलाई अवलोकन र आलोचना जनमुक्तिको अवलोकन र आलोचनाको अवलोकन र आलोचनालाई ढाक्नको लागि
You will have a respected and demanding career  and interesting and challenging role with the potential to change lives  for the better ,तपाईंसँग एक सम्मानित र करियर र चार्ज क्यारियर र चार्ज क्यारियर र चाखलाग्दो र चुनौतीपूर्ण भूमिका हुनेछ किनकि राम्रोको लागि जीवन परिवर्तन गर्न सक्ने सम्भावित रूपमा
festival of victory of Light on darknessThis Festival is distribute the message of enjoyamity and love in society,ब्राउजस्टमा प्रकाशको जीतको चाडलाई मज्जा र समाजमा माया र प्रेमको सन्देश वितरण गरिन्छ
The perspective was here is this poor professor,परिप्रेक्ष्य यहाँ थियो कि यो गरीब प्रोफेसर हो
Those who forget sometimes the objects of shopping list or the names of friends or pals may not be a metal disabled person or mentally ill person ,जसले कहिलेकाँही शपिंग सूची वा साथीहरूको नाम वा साथीहरूको नामहरू वा साथीहरूको नामहरू मेटल असक्षम व्यक्ति वा मानसिक बिरामी व्यक्ति हुन सक्दैनन्
Batsman changes its side while making runs or the over is completed,नुहाउने क्रममा ब्याट्सम्यानले यसको पक्ष परिवर्तन गर्दछ जब रन बनाउँदा वा समाप्त हुन्छ
It is difficult to establish the comparative advantage of this arrangement ; but it is of some significance that the Tariff Board LRB 1933 RRB opposed preference ,यस प्रबन्धको तुलनात्मक लाभ स्थापना गर्न गाह्रो छ; तर यो ट्याफ्रेन बोर्ड LRB 1933 RRB विरोधी प्राथमिकतामा छ
He used to be known as an extremely intelligent person,ऊ अत्यन्तै बौद्धिक व्यक्ति भनेर चिनिन्थ्यो
Morever  he could  decide the above suits only where the defendant owned up the charge ,जग्गा उसले माथिको सूट मात्र निर्णय गर्न सक्दछ जहाँ प्रतिवादीले चार्जको स्वामित्वमा रहेको छ
True art strikes its way through the Nile like the miraculous wand of Moses  ,साँचो कला नाइलतर्फ हिंड्ने छ किनकि डरलाग्दो कुरोजस्तै मोशाको लागि मोशाको कुट
Because there is a lot of autism genetics here,किनभने त्यहाँ एक धेरै अटिवामान जीविकान्स जीवाणुहरू छन्
Chief TypePad,मुख्य प्रकार
between bending the crucifix out of shape,आकार बाहिर क्रुसिफिक्स झुकाउँदै
And across the world every 20 minutes one new person,र विश्व भर हरेक 20 मिनेट एक नयाँ व्यक्ति
Political discussions with official circles having proved fruitless  Subhas Chandra paid more attention to propaganda on behalf of India through press statements and lectures and by promoting contacts in academic circles ,आधिकारिक सर्कससँग राजनीतिक छलफलले फलदायी सुभाष चन्द्ररालाई भारतका तर्फबाट प्रचार गर्न बढी ध्यान दिए र शैक्षिक सर्कलमा सम्पर्कहरू प्रमोट गरेर।
All those who helped him or promoted him were either insulted or ousted from the party by him ,उसलाई मद्दत गर्ने वा प्रमोट गर्ने उसलाई या त अपमान गरिएको थियो वा पार्टीबाट उथलियो
The tourists are advised to see the documentary film Man in Search of Man,पर्यटक पुरुषको खोजीमा कागजात फिल्म मानिस हेर्न सल्लाह दिइन्छ
4 Should be within the special powers of the House,The घरको विशेष शक्ति भित्र हुनुपर्दछ
In fact our planet is a water planet as it contains 70 per cent of water  the rest being the earth ,वास्तवमा हाम्रो ग्रह एक पानी ग्रह हो किनकि यसले 700 प्रतिशत पानी समावेश गर्दछ
In the ancient times this used to be a,प्राचीन समयमा यो बन्यो
In a space of a month  the Centre has dabbled in autonomy  a dialogue with the Hurriyat Conference and now the ceasefire call ,एक महिनाको दिनमा केन्द्रले हतियारकोट सम्मेलन र अब युद्धविरामकलाई एक वार्तालापमा चकित पारेको छ
As the Hindus call these tithis nychthemera  they also call the former half of a titht day  the latter half night ,हिन्दूले यी THESIS NYCHThemeARA लाई कल गरे अनुसार तिनीहरूले पनि पछिल्लो आधा रातमा पेथ्ट दिन
Sanskrit belongs to the family IndoEuropean languages and is classified under Indoarya subbranch of IndoIrani branch,संस्कृत परिवार इन्डिरोरोइजन भाषाहरूको हो र इंडो इरानी शाखाको indooya सब शाखा अन्तर्गत वर्गीकृत गरिएको छ
A fortnight later he was in Calcutta for a medical checkup  and on 19 September went up to Kalimpong to recuperate in the glorious autumn of the eastern Himalayas ,एक पन्ध्रौं पछि उनी एक मेडिकल चेकअपको लागि कलकत्तामा थिए र 1 19 सेप्टेम्बरमा पूर्वी हिमालयको महिमित शर्ट स्तरमा पुगेको थियो
are very different and distinct and that I had learned it very well,धेरै फरक र अलग छन् र मैले यो राम्रोसँग सिकें
In Uncertainties future temperature and total world different parts of hot and related changes involvedMost national govt Kyoto protocol are sighned,अनिश्चितताहरूमा भविष्यको तापमान र घन वर्ल्ड तातो र डेट र सम्बन्धित परिवर्तनहरू सम्मिलित नेशनल सरकार सरकार सरकार सरकारकोटो प्रोटोकोल देखिए
The poverty of the people found its visible manifestation in the series of famines which ravaged the country during the second half of the 19th century ,जनताको गरीबीले 1 th औं शताब्दीको दोस्रो भागमा देशको दौडान देशको प्रख्यात देखभाल देखायो र 1 th औं शताब्दीको दोस्रो आधा बृद्धि भएकोले
The mother swallows more and more meat  merely to feed her everhungry growing children ,आमाले अधिक र अधिक मासुलाई मात्र आफ्नो अनन्त बृद्धि बच्चाहरूलाई खुवाउन निल्नुहुन्छ
then we can save lives,त्यसो भए हामी जीवन बचाउन सक्छौं
but change the laws Change the global treaties,तर कानून परिवर्तन गर्नुहोस् ग्लोबल सन्धि परिवर्तन
(Laughter),(हाँसो)
The average age of a circus elephant is about 35 years ,एक सर्कस हात्तीको औसत उमेर लगभग years 35 बर्ष हो
or Nyan Cat?,वा nyan बिरालो?
Vegetables  papers  waste food  plastics and similar items should not be thrown in open drains  but placed inside paper bags and disposed off in bins kept in the streets by the local bodies for this purpose ,वा nyan बिरालो?
The State cannot keep a separate Constitution independently only one Constitution is applicable both to the Center and State,वा nyan बिरालो?
After the ducks are feathered  they are ready to range for themselves on tanks and lakes  where grass  snails  and other insects make up a considerable portion of their food ,वा nyan बिरालो?
Shrimad Bhagwat Geeta is one of the most sacred scripture of Hindu Religion,वा nyan बिरालो?
Just think even when its cloudy outside,वा nyan बिरालो?
can attest that Pakistanis are an incredibly hard working population,वा nyan बिरालो?
In wartorn places like Monrovia,वा nyan बिरालो?
no matter what the program ,वा nyan बिरालो?
Domestic dogs have had their tails curtailed for  if the palm trees had been too short  the giraffes would have been in great difficulty to eat their leaves ,वा nyan बिरालो?
Others may be due to metabolic or vascular changes as involvement of nerves causing neuropathy LRB involving nerves RRB  as in the altered sensations in hands and feet or weakness due to loss of motor power ,वा nyan बिरालो?
Calcutta was known as the  city of palaces  and the  city of gardens  in the early part of this century ,कलकत्तालाई पालास शहर र बगैंचा शहर को रूप मा परिचित थियो यस शताब्दी को प्रारम्भिक भाग मा
The people worship the land and it is supposed to be sinful to steal or sell it ,कलकत्तालाई पालास शहर र बगैंचा शहर को रूप मा परिचित थियो यस शताब्दी को प्रारम्भिक भाग मा
As 21 parts of Rugvedh101 parts of Yajurvedh 1000 parts of Saamvedh and 9 parts of Atharvavedh like this there are total 1131 parts,कलकत्तालाई पालास शहर र बगैंचा शहर को रूप मा परिचित थियो यस शताब्दी को प्रारम्भिक भाग मा
Vedvyas has combined 11 books of Upanishadas into single book so that common man can understand it and hence knowledge imparted by god is revelead to common human being,कलकत्तालाई पालास शहर र बगैंचा शहर को रूप मा परिचित थियो यस शताब्दी को प्रारम्भिक भाग मा
You need to take them out of search engines,कलकत्तालाई पालास शहर र बगैंचा शहर को रूप मा परिचित थियो यस शताब्दी को प्रारम्भिक भाग मा
The crisis was subsequently defused  but the BJP s relations with the RSS had by then sunk to an alltime low ,कलकत्तालाई पालास शहर र बगैंचा शहर को रूप मा परिचित थियो यस शताब्दी को प्रारम्भिक भाग मा
There are numerous baeutiful trees here hence this place has been named Sunderban (Beautiful forest),कलकत्तालाई पालास शहर र बगैंचा शहर को रूप मा परिचित थियो यस शताब्दी को प्रारम्भिक भाग मा
