english_sent,nepali_sent
politicians do not have permission to do what needs to be done,राजनीतिज्ञहरूसँग काम गर्न आवश्यक पर्ने कुरा गर्न अनुमति छैन
Id like to tell you about one such child,आईडी तपाईंलाई एक बच्चाको बारेमा बताउन मनपर्दछ
This percentage is even greater than the percentage in India,यो प्रतिशत भारतमा प्रतिशत भन्दा ठूलो छ
what we really mean is that theyre bad at not paying attention,हामी वास्तवमै के भन्न चाहन्छौटा हो कि तिनीहरू ध्यान दिएनन्
The ending portion of these Vedas is called Upanishad,यी Vedas को अन्त्य भाग विदाशीह भनिन्छ
The then Governor of Kashmir resisted transfer  but was finally reduced to subjection with the aid of British ,त्यसपछि काश्मिरका गभर्नरले रिसेन्स स्थापना गरे तर अन्ततः ब्रिटिशको सहायताको साथ अधीनमा रहेको थियो
In this lies the circumstances of people before you,यस भन्दा पहिले मानिसहरुको अवस्थाको अवस्था
And who are we to say even that they are wrong,र हामी को हौं कि तिनीहरू गलत छन्
Global Warming refer to warming caused in recent decades and probability of its continual presence and its indirect effect on human being,ग्लोबल वार्जीमेन्टले हालसालै हालसालैका दशक र यसको लगातार उपस्थिति र मानवमा यसको अप्रत्यक्ष प्रभावको सम्भावनाको कारणले पत्ता लगाउनुहोस्
You may want your child to go to a school that is not run by the LEA - a non-maintained special school or an independent school that can meet your child s needs ,तपाईं आफ्नो बच्चालाई स्कूलमा जान चाहनुहुन्छ जुन पुतेर जान्छ जुन खातामा चल्दैन - एक गैर-कायम गरिएको विशेष स्कूल वा एक स्वतन्त्र स्कूल जुन तपाईंको बच्चाको आवश्यकता पूरा गर्न सक्दछ
Please ensure that you use the appropriate form ,कृपया निश्चित गर्नुहोस् कि तपाईं उपयुक्त फारम प्रयोग गर्नुहुन्छ
Category: Religious Text,वर्ग: धार्मिक पाठ
This period summarily is pepped up with devotion,यो अवधि Subermally भक्ति संग परोपकारी छ
So there is some sort of justice,त्यसैले त्यहाँ केहि प्रकारको न्याय छ
The first two were found unreliable and the prosecution case rested mainly on the evidence of the remaining five approvers ,पहिलो दुई अविश्वसनीय भेटियो र अभियोजन केसले बाँकी पाँच स्वीकृतकर्ताहरूको प्रमाणमा विश्राम गरे
They had justified their educational policy of concentrating on the education of a small number of upper and middle-class people with the argument that the new education would gradually  filter down  from above ,उनीहरूले आफ्नो शैक्षिक नीतिलाई सूचित गर्ने तर्कको साथ केन्द्रित गरेका थिए कि यो तर्कसँगको सानो संख्याका व्यक्तिहरूको शिक्षामा नयाँ शिक्षा बिस्तारै तलबाट तल फिल्टर हुनेछ
And now at present the naturecure Ayurvedic and modern treatments are taking place through the government in Nepal,र अब अहिले प्रकृति उपभोक्ता र आधुनिक उपचार नेपालमा सरकार मार्फत भइरहेको छ
Parliament time frame is 5 years and this will be dissolved before that,र अब अहिले प्रकृति उपभोक्ता र आधुनिक उपचार नेपालमा सरकार मार्फत भइरहेको छ
ii Register Courts  empowered to try causes for amounts not exceeding Rs 200  when authorised by the judges ,र अब अहिले प्रकृति उपभोक्ता र आधुनिक उपचार नेपालमा सरकार मार्फत भइरहेको छ
Extreme weather due to increased mortality; displacements and economic loss will be compounded through growing population Although temperate climate has some benefits out of it such as decreased mortality due to cold weather,र अब अहिले प्रकृति उपभोक्ता र आधुनिक उपचार नेपालमा सरकार मार्फत भइरहेको छ
Of these Lahadi is a popular one ,र अब अहिले प्रकृति उपभोक्ता र आधुनिक उपचार नेपालमा सरकार मार्फत भइरहेको छ
Even a concentration of 0001 ppm of hydrogen sulphide in the water can emit the smell of rotten egg ,र अब अहिले प्रकृति उपभोक्ता र आधुनिक उपचार नेपालमा सरकार मार्फत भइरहेको छ
Islam is the worlds second-largest religion after Christianity,र अब अहिले प्रकृति उपभोक्ता र आधुनिक उपचार नेपालमा सरकार मार्फत भइरहेको छ
This changed slowly,र अब अहिले प्रकृति उपभोक्ता र आधुनिक उपचार नेपालमा सरकार मार्फत भइरहेको छ
Far more interesting are genetic diseases that arise essentially from the mutation of a single gene allowing a simple Mendelian distribution to appear in the offspring concerned ,र अब अहिले प्रकृति उपभोक्ता र आधुनिक उपचार नेपालमा सरकार मार्फत भइरहेको छ
The FIs are expected to offload the stake in favour of Suzuki -LRB- currently 50 per cent stakeholder -RRB- and to the general public later ,र अब अहिले प्रकृति उपभोक्ता र आधुनिक उपचार नेपालमा सरकार मार्फत भइरहेको छ
were being produced,र अब अहिले प्रकृति उपभोक्ता र आधुनिक उपचार नेपालमा सरकार मार्फत भइरहेको छ
Naren had three or four meetings with the Consul but found that he was making no progress ,र अब अहिले प्रकृति उपभोक्ता र आधुनिक उपचार नेपालमा सरकार मार्फत भइरहेको छ
All those who stand today under this flag are Indians  not Hindus  not Muslims  but Indians ,र अब अहिले प्रकृति उपभोक्ता र आधुनिक उपचार नेपालमा सरकार मार्फत भइरहेको छ
In some cases the High Courts have the jurisdiction to deal with matters more effectively as courts of first instance than the Supreme Court ,र अब अहिले प्रकृति उपभोक्ता र आधुनिक उपचार नेपालमा सरकार मार्फत भइरहेको छ
And you can see this LED is going to glow,र अब अहिले प्रकृति उपभोक्ता र आधुनिक उपचार नेपालमा सरकार मार्फत भइरहेको छ
Under the Act more than one Claims Tribunal can be set up and their territorial jurisdiction is specified by notification constituting the Tribunals ,र अब अहिले प्रकृति उपभोक्ता र आधुनिक उपचार नेपालमा सरकार मार्फत भइरहेको छ
to turn on the lights or to bring him a glass of water,र अब अहिले प्रकृति उपभोक्ता र आधुनिक उपचार नेपालमा सरकार मार्फत भइरहेको छ
Maine,र अब अहिले प्रकृति उपभोक्ता र आधुनिक उपचार नेपालमा सरकार मार्फत भइरहेको छ
IN farsi philosophy firdaus garden is presented as ideal one in Mugal literatures,र अब अहिले प्रकृति उपभोक्ता र आधुनिक उपचार नेपालमा सरकार मार्फत भइरहेको छ
Can you imagine saying that?,र अब अहिले प्रकृति उपभोक्ता र आधुनिक उपचार नेपालमा सरकार मार्फत भइरहेको छ
Head lice need to maintain contact with a host in order to survive ,र अब अहिले प्रकृति उपभोक्ता र आधुनिक उपचार नेपालमा सरकार मार्फत भइरहेको छ
Three: this is a good road in - right near where our factory is located,र अब अहिले प्रकृति उपभोक्ता र आधुनिक उपचार नेपालमा सरकार मार्फत भइरहेको छ
This may include injunctions  which can be highly effective preventive measures which can reduce the nuisance caused whilst allowing people to keep their homes ,र अब अहिले प्रकृति उपभोक्ता र आधुनिक उपचार नेपालमा सरकार मार्फत भइरहेको छ
Whats going on?,र अब अहिले प्रकृति उपभोक्ता र आधुनिक उपचार नेपालमा सरकार मार्फत भइरहेको छ
But after his demise his bother Sardar Vallabh Bhai Patel did not accept this will and filed a case in the court,र अब अहिले प्रकृति उपभोक्ता र आधुनिक उपचार नेपालमा सरकार मार्फत भइरहेको छ
He also saw with great anguish how  following the ultra-left line of the sixth Comintern congress  the communists had destroyed themselves and gravely damaged the left movement ,र अब अहिले प्रकृति उपभोक्ता र आधुनिक उपचार नेपालमा सरकार मार्फत भइरहेको छ
There are also financial reforms in rural China,र अब अहिले प्रकृति उपभोक्ता र आधुनिक उपचार नेपालमा सरकार मार्फत भइरहेको छ
That is the final lesson of the story ,र अब अहिले प्रकृति उपभोक्ता र आधुनिक उपचार नेपालमा सरकार मार्फत भइरहेको छ
It is a clash all along  of the old with the new  of real politik with idealism  of the means with-the end  of love claimed as of right and love given of free will  of home-bred virtue with the wild wind from the outside ,र अब अहिले प्रकृति उपभोक्ता र आधुनिक उपचार नेपालमा सरकार मार्फत भइरहेको छ
Progressive-minded  he advocated widow remarriage and raising the marriageable age of girls ,र अब अहिले प्रकृति उपभोक्ता र आधुनिक उपचार नेपालमा सरकार मार्फत भइरहेको छ
The range was comprehensive  the analysis sober and lucid  and the style so charming that what he said was itself afine specimen of literature ,र अब अहिले प्रकृति उपभोक्ता र आधुनिक उपचार नेपालमा सरकार मार्फत भइरहेको छ
Twenty of the years from 1860 to 1908 were years of famine ,र अब अहिले प्रकृति उपभोक्ता र आधुनिक उपचार नेपालमा सरकार मार्फत भइरहेको छ
This position is similar to armchair In this the male puts its legs slightly up near the knees and his hands are helpful to support the hips of the female The female spreads her leg touching his backand after letting her penis inside her vagina takes support on his arms by her handsIn thishe male and female remains quite closer and this provides quite closure,र अब अहिले प्रकृति उपभोक्ता र आधुनिक उपचार नेपालमा सरकार मार्फत भइरहेको छ
the family planning started in Vietnam and they went for smaller families,र अब अहिले प्रकृति उपभोक्ता र आधुनिक उपचार नेपालमा सरकार मार्फत भइरहेको छ
category:information technology,र अब अहिले प्रकृति उपभोक्ता र आधुनिक उपचार नेपालमा सरकार मार्फत भइरहेको छ
I mean at that time trust me,र अब अहिले प्रकृति उपभोक्ता र आधुनिक उपचार नेपालमा सरकार मार्फत भइरहेको छ
For Jayendra Saraswati  the spiritual has never been static ,र अब अहिले प्रकृति उपभोक्ता र आधुनिक उपचार नेपालमा सरकार मार्फत भइरहेको छ
Not only that,र अब अहिले प्रकृति उपभोक्ता र आधुनिक उपचार नेपालमा सरकार मार्फत भइरहेको छ
What we call instinct  what we always refer to disparagingly in our daily lifethis it is that leads us out of the jungle of virtues and vices  elations and afflictions  into an awareness of the unlimited possibilities of our destiny ,र अब अहिले प्रकृति उपभोक्ता र आधुनिक उपचार नेपालमा सरकार मार्फत भइरहेको छ
humans destroyed the commons that they depended on,र अब अहिले प्रकृति उपभोक्ता र आधुनिक उपचार नेपालमा सरकार मार्फत भइरहेको छ
Almost goes to E but otherwise the play would be over,र अब अहिले प्रकृति उपभोक्ता र आधुनिक उपचार नेपालमा सरकार मार्फत भइरहेको छ
Aryans did not make any statues or temples for deities,र अब अहिले प्रकृति उपभोक्ता र आधुनिक उपचार नेपालमा सरकार मार्फत भइरहेको छ
It has three small domes and has been constructed using white marble,यसको तीन साना डोमिटहरू छन् र सेतो मार्बरको प्रयोग गरेर निर्माण गरिएको छ
But January 2002 has been quiet ,तर जनवरी 2002 शान्त भएको छ
External links,बाह्य लिंकहरू
On the rear wall  in a special niche  is carved the usual Somaskanda panel  with Siva and Uma seated with little Skanda on Uma s lap and Brahma and Vishnu standing behind on either side ,बाह्य लिंकहरू
So I want to share with you a couple key insights,बाह्य लिंकहरू
France  Belgium ; Germany  the United States  Russia  and later  Japan developed powerful industries and began to search for foreign markets for their products ,फ्रान्स बेल्जियम; जर्मनी संयुक्त राज्य अमेरिका रूस र पछि जापानले ठूलो उद्योगहरू विकास गर्यो र आफ्ना उत्पादनहरूको लागि विदेशी बजारमा खोजी गर्न थाले
But if you agree to allow the seller extra time  you cannot cancel until that time is up ,तर यदि तपाईं विक्रेता अतिरिक्त समयलाई अनुमति दिन सहमत हुनुहुन्छ भने तपाईं रद्द गर्न सक्नुहुन्न
Many countries in the [unclear] they need legitimacy,[अंकर] मा धेरै देशहरू तिनीहरूलाई वैधानिकता चाहिन्छ
This change has contributed,यो परिवर्तनले योगदान पुर्याएको छ
is to create ownership in the community to the problem,समुदायमा स्वामित्व प्राप्त गर्न समस्यामा सिर्जना गर्नु हो
Buddha and danceroom (1958),समुदायमा स्वामित्व प्राप्त गर्न समस्यामा सिर्जना गर्नु हो
the arrangements for setting short-term goals  regularly reviewing your child s progress towards those goals  and how your child s progress is to be monitored ,समुदायमा स्वामित्व प्राप्त गर्न समस्यामा सिर्जना गर्नु हो
He often spoke to us of his own great longing to meet him ,समुदायमा स्वामित्व प्राप्त गर्न समस्यामा सिर्जना गर्नु हो
In this positive connotation  liberty would mean freedom of the individual to do what one likes ,समुदायमा स्वामित्व प्राप्त गर्न समस्यामा सिर्जना गर्नु हो
Thus  even aslthe Central Legislature s power to make laws for the whole of British India  for British subjects and servants of tie Crown in India  and for all British Indian subjects within as well as without British India was reiterated  it continued to be subject to many important limitations which were designed either to keep the sovereignty of the British Parliament intact or to maintain the supremacy of the Governor-General and his Council ,समुदायमा स्वामित्व प्राप्त गर्न समस्यामा सिर्जना गर्नु हो
greatly understate its impact,समुदायमा स्वामित्व प्राप्त गर्न समस्यामा सिर्जना गर्नु हो
We use a different style of WP1 application form depending on whether you intend to send the application to us by e-mail or post ,समुदायमा स्वामित्व प्राप्त गर्न समस्यामा सिर्जना गर्नु हो
He wanted to teach gurubhai a lesson and giving respect to all the things of Gurudev he took the spitbowl filled with blood and cough and threw it on gurubhai bed,समुदायमा स्वामित्व प्राप्त गर्न समस्यामा सिर्जना गर्नु हो
1)Sanskrit is worlds oldest language of vedas,समुदायमा स्वामित्व प्राप्त गर्न समस्यामा सिर्जना गर्नु हो
the Carrier Hotel,समुदायमा स्वामित्व प्राप्त गर्न समस्यामा सिर्जना गर्नु हो
that it learns or is pre-programmed,समुदायमा स्वामित्व प्राप्त गर्न समस्यामा सिर्जना गर्नु हो
Where programmes have been slow to deliver results  for example on truancy  the Government is intensifying action ,समुदायमा स्वामित्व प्राप्त गर्न समस्यामा सिर्जना गर्नु हो
have different colors and different textures to our eye,हाम्रो आँखामा विभिन्न र colors ्गहरू र फरक-फरक बनावटहरू छन्
parliaments control on financial health,हाम्रो आँखामा विभिन्न र colors ्गहरू र फरक-फरक बनावटहरू छन्
However  in the meantime  there was an influx of people from other States particularly from the South and more people were inducted under various other schemes of rehabilitation ,हाम्रो आँखामा विभिन्न र colors ्गहरू र फरक-फरक बनावटहरू छन्
And I think any wise life will accept,हाम्रो आँखामा विभिन्न र colors ्गहरू र फरक-फरक बनावटहरू छन्
Among the principal  infant  industries of this period mention must be made of sugar  paper  and matches ,हाम्रो आँखामा विभिन्न र colors ्गहरू र फरक-फरक बनावटहरू छन्
After you have made enough to rebuild the cottage  I shall take you back as my Queen  ,हाम्रो आँखामा विभिन्न र colors ्गहरू र फरक-फरक बनावटहरू छन्
2 Sursaravali,हाम्रो आँखामा विभिन्न र colors ्गहरू र फरक-फरक बनावटहरू छन्
In spite of greater use of machinery on the plantations  the organisation of a colliery was less patterned on the lines of the factory system  IRON AND STEEL INDUSTRY,हाम्रो आँखामा विभिन्न र colors ्गहरू र फरक-फरक बनावटहरू छन्
While it helps diplomatically to have a country like the UK openly come out with a legislation like this  what is important is the question of the difference this would make to insurgency  say  in Kashmir ,हाम्रो आँखामा विभिन्न र colors ्गहरू र फरक-फरक बनावटहरू छन्
to create a dry mist,हाम्रो आँखामा विभिन्न र colors ्गहरू र फरक-फरक बनावटहरू छन्
Chawlas responsibilities included the microgravity experiments for which the crew conducted nearly 80 experiments studying earth and space science advanced technology development and astronaut health and safety,हाम्रो आँखामा विभिन्न र colors ्गहरू र फरक-फरक बनावटहरू छन्
In the middle of 1700th centuryafter the beginning of industrial revolutionthe atmospheric concentrations of CO2 and CH4 has increased 31% and 149% respectivelyDuring the past 650000 years these levels are considered to be very high than at any time,हाम्रो आँखामा विभिन्न र colors ्गहरू र फरक-फरक बनावटहरू छन्
in these the main are farakka damtihari damand bheemghoda dam,हाम्रो आँखामा विभिन्न र colors ्गहरू र फरक-फरक बनावटहरू छन्
than are put into malaria,हाम्रो आँखामा विभिन्न र colors ्गहरू र फरक-फरक बनावटहरू छन्
when the space race was going on,हाम्रो आँखामा विभिन्न र colors ्गहरू र फरक-फरक बनावटहरू छन्
Perhaps there are problems that you do nt know about ,हाम्रो आँखामा विभिन्न र colors ्गहरू र फरक-फरक बनावटहरू छन्
