english_sent,nepali_sent
Solar energy: Sun is renewable & environment friendly source of great energyTherefore people have found it to be the way of life & culture,सौर्य ऊर्जा: घाम महान उर्जाटेरको ग्रेट उर्जाेटका लागि नवीकरणीय र वातावरण मैत्री स्रोत हो जुन जीवन र संस्कृतिको बाटो हो
Gandhiji is told that the failure of Pattabee Sitarmaiyya is his own failureand told the his partner if they are not agree with Subhashbabu styleso they are move the congress,गान्दजालाई भनिएको छ कि पाटबेब्जैको जातीजाको विफलता उनको असिद्ध छ कि उनी सुभ्याबुबु सद्लिक्षसँग सहमत छैनन् भने उनीहरू सहमत छन्
If there is more than one arbitrator  the parties have to appoint an  umpire  to whom the dispute is referred if there is any disagreement between the arbitrators ,यदि एक भन्दा बढी मध्यस्थ छ भने दलहरुले अडी रेयर नियुक्त गर्नुपर्यो कि मध्यस्थताकर्ताहरु बीच कुनै असहमत छ कि भनेर संचार उल्लेख गरिएको छ
The sandhara and sarvatobhadra forms are the most outstanding ,Sharrhara र Sarvhtobaha फारम सबै भन्दा उल्लेखनीय छन्
I believe we have to attend,म विश्वास गर्दछु कि हामी उपस्थित हुनुपर्छ
All the major religions give us calendars,सबै प्रमुख धर्महरूले हामीलाई क्यालेन्डरहरू दिन्छ
Now I am having a title like,अब म जस्तो शीर्षक भएको छु
Mahanta survived an assassination bid by the ULFA but not the stigma of the Rs 200crore veterinary scam ,महान्टा युएफडाले एक हत्या भइनर्देडबाट बचायो तर 200CRRORE VERERENININE घोटाला को stignma छैन
after some days subash babu was acquitted out of congress,केही दिन पछि सुभाष बाबुले crast ्ग्रेसबाट बरामर्श लिएको थियो
And then finally,र त्यसपछि अन्तमा
and the Lebanese,र लेबनानी
This word is made in Pharisee word Paridaeza this mean is one wall protected garden,यो शब्द फरिसी शब्द परिचाराइजामा गरिएको छ यसको मतलब एक भित्ता सुरक्षित बगैचा हो
Most of Roy s loyal supporters as well many leftwing nationalists  who had come to his defence  were in jail ,धेरै रोइ s वफादार समर्थकहरु धेरै बायाँ बाँकी राष्ट्रवादीहरु जो आफ्नो प्रतिरक्षा आएका थिए भने जेल जेल मा थिए
The rest is for others ,बाँकी अरूको लागि हो
A Ghana Airways pilot falls into the same predicament,एक घाना एयरवेज पाइलट एकै तरीकाले झर्छ
In some instances the person who ventured to bring a breach to a court  himself got into trouble for his pains and was fined ,केहि उदाहरणहरुमा एक व्यक्ति एक अदालत को एक उल्लंघन ल्याउन को लागी एक अदालत को एक अदालत को एक अदालत को लागी समस्याहरु मा प्राप्त र पखेटा थियो
The Quran has dealt with the attributes of God definitely and comprehensively but it observes the greatest caution in discussing His Essential Being ,कुरानले पक्कै पनि परमेश्वरका गुणहरू पक्कै र विस्तृत रूपमा व्यवहार गरेको छ तर यसले उहाँको जनल्ला अस्थिरताको बारेमा छलफल गर्न सबैभन्दा ठूलो सावधानी अवलोकन गर्दछ
features:full optionsonlinedevanagiri supported(WYSWYG),सुविधाहरू: पूर्ण विकल्प onlendevanagiagiri समर्थित (Wysiwyg)
Brahma has two forms: Parabrahma and Aparbrahma,ब्रामामा दुईवटा फारमहरू छन्: प्याराब्राआ र Apararharma
The next day in the Jammu sector  they killed 19 people  including 15 Hindu residents  women and children in Doda ,अर्को दिन जममु क्षेत्रमा उनीहरूले 1 people जनालाई डेलआवासीहरू र बच्चाहरूलाई डीडामा 1 people जनाको हत्या गरे
Having done his work and won his fight in South Africa  Gandhi had returned to his country but had not yet made up his mind what he was going to do or where he was going to stay ,आफ्नो काम गरिसकेपछि उनले उनको लडाई जित्यो।
These are the three main tiers in our Criminal Courts ,यी हाम्रो आपराधिक अदालतमा तीन मुख्य तहहरू हुन्
The temple became everything  to him ,मन्दिर उसको लागि सबै कुरा भयो
Myth : Flooding of imported goods is hurting the Indian industry ,मिथक: आयातित सामानको बाढीले भारतीय उद्योगलाई चोट पुर्याइरहेको छ
to certainty,निश्चितता
There are a bit harder issues,त्यहाँ एक बिट कडा मुद्दाहरू छन्
But Dr Tarachand in his valuable book The Influence of Islam on Indian Culture has proved that these movements were inspired by the impact of Islam ,तर उसको मूल्यवान ताराचन्डमा भारतीय संस्कृतिमा इस्लाम को प्रभावले प्रमाणित गरेको छ कि यी आन्दोलनहरू इस्लामको प्रभावबाट प्रेरित थिए
trust me we will sink to them,मलाई विश्वास गर्नुहोस् हामी उनीहरूसँग डुब्नेछौं
They see us as adults rational adults,तिनीहरूले हामीलाई वयस्कहरूको रूपमा देख्छन्
Late Shri GV  Mavalankar  the First Speaker of Indian Parliament  held that the Committee on Subordinate Legislation is the  custodian of the duties of Parliament  and keeps the administration within bounds intended by Parliament ,भारतीय संसदको पहिलो विधान सम्बन्धी तनावग्रस्त कानूनको अधीनमा रहेको धब्बाली gv हस्तक्कटक संसदको कर्तव्य हो र प्रशासनलाई संसदले चाहेको सीमाना राख्दछ
Thus  in the final analysis  there are only two forces in India todayBritish imperialism and the Congress representing Indian nationalism ,यसैले अन्तिम विश्लेषणमा भारतमा आज दुई भागहरू छन् जुन भारत भारती शाहीयता र कांग्रेस भारतीय राष्ट्रवादको प्रतिनिधित्व गर्दै छन्
A lot more to be said about that,यसको बारेमा धेरै कुरा बताउन
India has taken note of US President George W  Bush s State of the Union address where he labelled the Pakistanbased JeM as part of the  terror underworld  and praised Musharraf s  strong leadership  ,भारतले युएस राष्ट्रपति जर्ज W बुश अफको नोट लिएको छ जुन उनले पाकिस्तानबिच जीएमलाई आतंकवादी जयकारको भागको रूपमा लेबल लगाए र भने
Dainik Jagaran (epaperUnicoded),Dineik Jagran (japere युनिकोड)
So what were saying is that scalability,त्यसोभए के भन्दै थियो त्यो त्यो स्मालता हो
To be sure  the scale of the state Government s rebuilding project was staggering ,पक्का हुन राज्य सरकारको पुनर्निर्माण परियोजनाको मापन आश्चर्यजनक थियो
However  every time the period of reservation comes to an end  the Government in its wisdom decides to extend it further by amending the relevant provision of the Constitution LRB article 334 RRB ,यद्यपि प्रत्येक पटक आरक्षणको समन्वय अन्तसम्मै सरकारले संविधानको प्रासंगिक प्रावधानको संशोधन गरी यसका बुद्धिमत्ता सरकारले थप जानकारी गराउने अधिकारले जानकारी दिए।
A batsman can be out by 10 ways and some are not common and very less examples are found of it Out can be made by bold catch lbw run out stumped and hit wicketCommon one is to hit a ball two times handling the ball time out and destroying the ground,एक ब्याट्सम्यान 10 द्वारा बाहिर हुन सक्छ र केहि सामान्य छैन र कम कम उदाहरणहरू बोल्ड क्याच गर्न को लागी एक बल मार्न र नष्ट गर्न को लागी एक बललाई हिर्काउन सकिन्छ जमीन
They can come in to you account or a sub account or whatever,तिनीहरू तपाईंलाई खातामा आउन सक्छन् वा सब खाता वा जे पनि
She uses the main gallery as a shelter for larvae that hatch ,उनी मुख्य ग्यालरीलाई लार्भाको लागि आश्रयको रूपमा प्रयोग गर्छिन्
The court of the emperor was the highest court of appeal  the supreme tribunal of the land ,सम्राटको अदालत भूमिको सर्वोच्च अदालतको सर्वोच्च अदालतको उच्चतम अदालत थियो
Their demand was the Government should  remove all obstacles  to the building of a Ram temple at the former site of the Babri Masjid by March 12 ,Babri MabJisty को पूर्व साइटको पूर्व रेजिजनको पूर्व साइटमा राम मन्दिर निर्माण गर्न सरकारले सबै अवरोधहरू हटाउनु पर्छ
This era has shown immense devotion among the people of that time,यस युगले त्यस समयको मान्छे बीच अथाह भक्ति देखाएको छ
For people bringing up a child or children,बच्चाहरु वा बच्चाहरु को लागी मान्छे को लागी
Temperature of the lower troposphere has increased by 012 to 022 degrees C (022 to 04 degrees F) every decade as per the satellite temperature measurements It is generally agreed that before 1850 for the last one or two thousand years temperature has almost remained constant with some occassional ups and downs like the Medieval Warm Period and the Little Ice Age,तल्लो ट्रफीको तापक्रम 0 122 देखि 022 डिग्री सेप्टेम्बर (022 डिग्री 0 04 डिग्री एफ) 0222262 डिग्री 0 04 04 डिग्री f सम्म बढेको छ जुन लगभग 1 yearly500 भन्दा पहिले नै करिब छ। मध्ययुगीन तातो अवधि र सानो बरफ उमेर जस्तै
sitting at a keyboard,किबोर्डमा बसेर
These circumstances show that the persons on board in charge of Savarkar might well have believed that they could count on the assistance of the French police ,यी परिस्थितिहरूले देखाउँदछ कि राज्यार्रिकारको चार्ज बोर्डमा व्यक्तिहरूले राम्रोसँग विश्वास गरे कि तिनीहरू फ्रान्सेली पुलिसको सहयोगमा भर पर्न सक्छन्
It does nt have to be anything special ; it could be a trip to the cinema  a visit to a football match  or even just watching television together ,यो एनटी केहि विशेष हुनु पर्छ; यो सिनेमाको यात्रा हुन सक्छ एक फुटबल खेल वा केवल सँगै टेलिभिजन हेर्दै
Also contact your Jobcentre for more information about schemes to help you start work ,काम सुरु गर्न योजना सुरु गर्न योजनाहरूको बारेमा अधिक जानकारीको लागि तपाईंको कामसेन्टरलाई सम्पर्क गर्नुहोस्
On this pretext the British Government arrested Subhashbabu & kept him imprisoned at Mandaley jail in Myanmar without suing him,यस बहानामा बेलायती सरकारले शहाश बाबुले उनलाई सुंगरा बिना मन्डाले जेलमा राखिएको राख्यो
And she wakes up and she looks down at herself,र उनी उठ्छन् र उनी आफैंमा हेर्छिन्
The Committee performs a vital role in safeguarding the powers and prestige of the Parliament and its members ,समितिले संसदको शक्ति र प्रतिष्ठाको प्रतिष्ठाको रक्षा गर्न समितिको महत्त्वपूर्ण भूमिका खेलेको छ
Because doodling is so universally accessible,किनभने doodling यति विश्वव्यापी पहुँच योग्य छ
after the touch of lord shiva to ganga ganga became a sacred river and the people of universe started worshipping it,गंगा गंगालाई प्रभु शिव एक पवित्र नदी बनेपछि र ब्रह्माण्डका मानिसहरूले यसको पूजा गर्न सुरु गरे
Bharat Operating System Solution or BOSS,भरत अपरेटिंग प्रणाली समाधान वा मालिक
Those dreams are for India  but they are also for the world  for all the nations and peoples are tot RRB closely knit together today for any one of them to imagine that it can live apart ,ती सपनाहरू भारतका लागि हुन् तर तिनीहरू सबै राष्ट्रका लागि पनि संसारका लागि हुन् र आज कुनै एकका लागि आज एक अलग रहन सक्छन् भन्ने कल्पना गर्न सक्छन्
London United Kingdom,लन्डन एकजुट राज्य
On 12th October 2007 Bachan left his claim on land in Daulatpur village in Barabaki District Uttar Pradesh,12 अक्टुबर 200 2007 मा बाननाकी जिल्लामा गुलाटपुर गाउँमा जग्गामा उनको दावीमा उनको दावी छोडे
Wear bright colours/fluorescent clothing during the day and reflective clothing at night as a pedestrian  cyclist or motorcyclist ,रातमा उज्यालो र colors ्गी कपडाहरू लगाउनुहोस् र रातमा प्याडस्ट्रियन साइकल चालक वा मोटरसाइक्लिस्टको रूपमा
Elephanta caves are declared as world heritage,एलेन्टा युएभ्स विश्व सम्पदाको रूपमा घोषित गरियो
using what my students call the granny cloud,मेरो विद्यार्थीहरूले ग्रानी क्लाउडलाई बोलाएर प्रयोग गर्दै
Sidharth started searching for the answers of his questions along with two Brahmins,सिधार्ताले दुई ब्राह्मणको साथ आफ्ना प्रश्नहरूको उत्तर खोज्न थाले
Really Simple Syndication is abnormal,वास्तवमै साधारण सिन्डिकेशन असामान्य छ
He decided to kill police superintentant Sinders secretly,उनले पुलिस सुपरिटेन्डेन्ट सिन्धकहरू बोल्ने निर्णय गरे
Akbar was born in the palace of Rana Amar Sal in Umar Kot Sindh [in present Pakistan] on 23 November 1542 [According to Hijri 4th Day of Rajjab 949],अक्मारको कारमा ओरमार अमार्णको दरबारमा 2 November नोभेम्बर 1 14422 मा 2 नोभेम्बर 1 1422 मा राय 1 15422 [Jujjabab 94]]
The draft declaration  which calls for reparation for slavery  has upset nations including the US ,मस्यौदा घोषणा जुन दासत्वको लागि क्षतिपूर्तिको लागि अनुमति छ अमेरिका सहितको राष्ट्र
The principal functions discharged by such tribunals were conciliatory and local rulers did not usually interfere in their working ,यस्ता प्रमुख कार्यहरू यस्ता प्रमुख कार्यहरू concilitic र स्थानीय शासकहरूले सामान्यतया आफ्नो काम मा हस्तक्षेप गरेन
about my connection with Feynman,मेरो feynman संग मेरो सम्बन्धको बारेमा
if in the match every team is to play one innings then the no of balls is fixed so the limited over match is called the one day matchso the team which makes maximum runs win the matchhere draw does not take placeif due to monsoon and rains play is interrupted then only match is called as draw also there is duck worth Lewis system there which winner is announced,यदि खेलमा प्रत्येक टीम एक इनिंग खेल्नु हो भने बेलहरू निश्चित गरिएको छैन त्यसैले मिल्दो म्यानसोसनले मानसूनको कारणले वाइनको बराबरी लिएको छैन अवरोध भएमा मात्र मेल खाएको छ त्यहाँ डकल लेवीज प्रणालीको लायक छ त्यहाँ बतखको लायक छ जुन विजेता घोषित भएको छ
propane and benzene,प्रोपेन र बेन्जेन
In that case the king has no right to meddle with the inheritance  but it is exclusively spent on almsgiving ,त्यो अवस्थामा राजाको उत्तराधिकारको साथ हस्तक्षेपको अधिकार छैन तर यो विशेष गरी अम्स्मिंगमा खर्च गरिन्छ
But rivals say he is vainglorious and never misses an opportunity to promote himself  something quite unRSS like ,तर प्रतिद्वन्द्वीहरु भन्छन् कि उनी अनुपयुक्त छन् र आफूलाई केहि पनि धेरै पिउने कुरा बढावा दिने अवसर कहिल्यै याद गर्दैनन्
India has acquired the confidence to assert its legitimate Asian role  and it s ready to reach out ,भारतले यसको वैध एशियाली भूमिकालाई जोड दिन विश्वस्तता प्राप्त गरेको छ र पहुँच गर्नको लागि तयार छ
daal bati,डेटा ब्याट
But literally within days of arriving I was told in no uncertain terms,तर शाब्दिक रूपमा आइपुगेको दिन भित्र मलाई कुनै अनिश्चित सर्तहरूमा भनिएको थियो
I  therefore  request all  Hindus and Muslims  to unite and increase your strength as early as possible ,यसैले म सबै हिन्दू र मुस्लिमलाई एकजुट गर्न र सकेसम्म चाँडो तपाईंको शक्ति बढाउनुहोस्
because thats what brings joy to life,किनभने जीवनमा आनन्द ल्याउँछ
To this he answered yes old light will go and new will arrive,यसमा उनले जवाफ दिए होने प्रकाशमा जान्छ र नयाँ आइपुग्नेछ
every day in an act closely associated with,प्रत्येक दिन एक कार्यमा नजिकैको साथ सम्बन्धित
By Article 141 of the Constitution of India the framers of the Constitution have provided that  the law declared by the Supreme Court shall be binding on all courts within the territory of India  ,भारतका संविधानको धारा 1 141 द्वारा संविधानकारेले सर्वोच्च अदालतले घोषणा गर्ने कानून भारतको इलाका भित्र सबै अदालतमा बाध्यकारी हुनेछ
The city became like a second paradise,शहर दोस्रो प्रमोदवनको रूपमा भयो
and my homeland,र मेरो मातृभूमि
In addition to this general objective  the railway expansion programme has been oriented to meet specific developmental problems encountered from time to time ,यस जनरल उद्देश्यको अतिरिक्त समयसमयमा विशिष्ट विकास कार्यक्रमहरू पूरा गर्न उन्मुख भएको छ
is very very different and the countries are moving more or less,धेरै धेरै फरक छ र देशहरू अधिक वा कम चलिरहेका छन्
This will show the magistrates that you have an arguable case ,यसले मजिस्ट्रेटहरू देखाउँदछ जुन तपाईंसँग एक अव्यावर्तनीय मामला छ
They are raised primarily for meat ,तिनीहरू मुख्य रूपमा मासुको लागि उठाइन्छन्
He was a writer of immense talent,ऊ अथाह प्रतिभाको लेखक थियो
When he recovered it   I was as if no longer the same man ,जब ऊ पुन: प्राप्ति भयो म उही मान्छे होइन
Bachhan take an effort to return as an actor through Mrityudaata made by ABCL in 1997,बाचनले 1 1997 1997 in मा अपहरणको अपहरणको माध्यमबाट एक अभिनेता को रूप मा फिर्ता फर्कन एक प्रयास लिनुहोस्
The immortal door of Fateh pur Sikri,भाग्य ईन्टर सिरिकरीको अमर ढोका
